{
  "schema": "harness/failure-eval-candidate",
  "version": 1,
  "candidate_id": "E-OWNER-20260813-001",
  "failure_class": "host-surface-discovery-and-session-durability",
  "occurrences": [
    {
      "observed_at": "2026-08-13T00:15:00+07:00",
      "work_id": "W-pencil-preview",
      "claim_id": "C-012",
      "failure": "Pencil desktop app was already logged in, yet the harness treated CLI login as a prerequisite and blocked the preview. MCP connected fine through the desktop app socket with no CLI auth.",
      "evidence_ref": ".agent/evidence/harness-universal-reconciliation-v1/S5/evidence.json"
    },
    {
      "observed_at": "2026-08-13T00:16:00+07:00",
      "work_id": "W-browser-session",
      "claim_id": "C-011",
      "failure": "Browser QA opened and closed a fresh session per check; owner wants one durable visible session kept open for direct observation and interaction.",
      "evidence_ref": ".agent/evidence/harness-universal-reconciliation-v1/S5/evidence.json"
    }
  ],
  "promotion_status": "draft",
  "created_at": "2026-08-13T00:16:00+07:00",
  "workaround": {
    "owner": "harness-maintainer",
    "trigger": "host surfaces (desktop app, browser) must stay visible and durable; CLI auth is not the only live fact",
    "scope": "Pencil discovery order (desktop-app-first) + durable visible browser/MCP sessions in local QA",
    "revalidation_required": true,
    "revalidation_evidence": "evals/harness/visible-sessions/revalidation-2026-08-13.json",
    "expires_at": "2026-11-13T00:00:00+07:00",
    "retirement_evidence": "evals/harness/visible-sessions/retirement-2026-11.json"
  }
}
