{
  "schema": "harness/failure-eval-candidate",
  "version": 1,
  "candidate_id": "E-WORKAROUND-001",
  "failure_class": "host-mcp-workaround",
  "occurrences": [
    {
      "observed_at": "2026-08-12T11:00:00+07:00",
      "work_id": "W-wa-001",
      "claim_id": "C-012",
      "failure": "host exposes no stable browser MCP server id; ad hoc id mapping used"
    }
  ],
  "promotion_status": "accepted",
  "promotion_review": {
    "reviewed_by": "context-evolution-review",
    "reviewed_at": "2026-08-12T11:30:00+07:00",
    "verdict": "promote",
    "replay_required": true,
    "replay_refs": [
      "evals/harness/failure-to-eval/replay-browser-timeout.json"
    ]
  },
  "workaround": {
    "owner": "harness-maintainer",
    "trigger": "host lacks a stable browser MCP server id",
    "scope": "browser.verify activation on this host only",
    "revalidation_required": true,
    "revalidation_evidence": "evals/harness/workaround-revalidation/browser-mcp-2026-08.json",
    "expires_at": "2026-11-10T00:00:00+07:00",
    "retirement_evidence": "evals/harness/workaround-retirement/browser-mcp-retired.json"
  },
  "created_at": "2026-08-12T11:05:00+07:00"
}
